document_id,case_name,case_court,case_date,case_jurisdiction,text_content,document_type
1862656,State use Perryman vs. Stephens et al.,"{'name_abbreviation': 'Ark.', 'id': 8808, 'name': 'Arkansas Supreme Court'}",1853-07,Ark.,"Mr. Justice Walker
elivere the opinion of the Court.
The action in this case was brought upon the official bon of a sheriff, against himself an his securities. After setting out the bon with its conitions, the plaintiff avers that Nancy Perry-man, for whose use the suit is brought, commence her action in replevin for slaves, against William Drew in the Sebastian Circuit Court, an sue out her writ of replevin, which, whilst in full force, was place in the hans of the qualifie eputy of sai Stephens, who was then sheriff of Sebastian county, by which he was commane that if the sai Nancy Perryman shoul give security as require by law, that he cause sai slaves to be replevie an elivere to her; that sai sheriff i, whilst sai writ was in full force, by his eputy, take sai slaves by virtue thereof into his possession. An the plaintiff then alleges, as a breach of the official uty of sai sheriff that he refuse to take bon an security as require by law, from sai Nancy Perryman; but frauulently intening to injure an cheat her out of the negroes, elivere them to sai Drew.
The secon count is in all respects like the first, with this ifference, that it is allege for a breach, that sai sheriff, by his eputy, took the slaves into possession, by virtue of sai writ, but woul not, an i not take bon from the sai Nancy Perryman as require by law, an wholly faile an refuse to o so.
To this eclaration a emurrer was file, the groun of which was, that the breach assigne in each is insufficient in this, that it was not sufficient to aver that the sheriff refuse to take a bon, fyc., or that he woul not take such bon, or i not take it, but that in orer to charge the sheriff for a breach of official uty, it was necessary to aver that the sai Nancy Perryman, or some one for her, execute an tenere such bon, as require by law, to the sheriff before he execute his writ, or took the property into possession uner it. The emurrer was sustaine by the Circuit Court, an the plaintiff having ecline to amen, final jugment was renere in favor of the efenants, from which the plaintiff appeale.
There can be no oubt but that the sheriff was not only not boun to take the property into possession, without first having the security require by the statute, but it was clearly his uty to esist from any attempt to execute the writ until such bon was tenere to him. The comman in his writ is conitional: that “if the plaintiff shall give you security,” &c., “you cause the goos an chattels to be replevie an elivere to the plaintiff,” &c.
The 10th sec. Dig. ch. 146, provies that such writ shall not be execute in any case, unless the plaintiff, or some other person in his behalf, shall execute bon, &c. An the 12th sec. provies “that upon the receipt of such writ an bon before require, the sheriff shall forthwith procee to execute such writ,” &c. No one can rea these sections without being satisfie that the sheriff exceee his power an authority in taking the slaves into his possession, without having receive the bon intene for the protection an security of the efenant, an that having one soj he was uner no obligation to retain the property so taken; inee, it was his uty at once to restore it to the efenant. The statute oes not require of the sheriff to prepare a bon, nor to eman one, but before he is authorize or require to execute the writ, it is the uty of the plaintiff to make, by herself, or some one for her, a goo an sufficient bon, conitione as require by the statute with sufficient surety, an to tener it to the officer. Then shoul he refuse or neglect to perform his uty he may be hel to account by the party injure; an shoul he, as in this instance, improviently take the property into his possession without first having receive such bon, (to place the case in the most favorable attitue for the plaintiff,) it was the plaintiff’s uty to prepare an tener such bon before the sheriff coul be hel accountable for not elivering the property to her.
The language use in the breach oes not necessarily imply that a bon was tenere. A “refusal to take a bon,” or in the secon count, “that the sheriff i not an woul not take a bon,” are not equivalent to a tener an offer of a bon, prepare as require by law. The grouns of the refusal or failure to take bon are not state. The plaintiff may have offere to prepare a bon, an the sheriff have ecline to hol up the property until it was one, or for other cause, an uner the rule'that the pleaer must be suppose to have presente the facts in the most favorable aspect for his client, we must presume that ha a bon been tenere an offere to the sheriff it woul have been so state.
We think the grouns for the emurrer well taken.
Jugment affirme.",legal_case
1862634,"Higgs, as admr. vs. Warner","{'name_abbreviation': 'Ark.', 'id': 8808, 'name': 'Arkansas Supreme Court'}",1853-07,Ark.,"Mr. Justice Scott
elivere the opinion of the Court.
Higgs, as aministrator, sue Warner, in assumpsit, for services renere by his intestate in his lifetime, as an attorney at law, an as an orinary agent, exhibiting a bill of particulars. Warner, besies the pleas of non-assumpsit an set-off, relie upon the plea of the statute of limitations. The replication to the latter plea, although taken in short on the recor by consent, we shall consier as a special one ; otherwise, the plaintiff’s case woul be at an en at once for want of appropriate allegations of the special facts, which he complains the court below refuse to allow him to prove by the evience he offere. The evience thus offere, an which the court refuse to permit the plaintiff to prouce to the jury, was, that of “ an account” file in the Probate Court, upon which Warner obtaine an allowance against the estate of the intestate, “ for ebts” ue by Hightower, the intestate, at the time of his eath, which bore ate an were charge within three years, next before the commencement of this suit. The object avowe by the plaintiff in offering this evience, was to prove by it that a mutual open account current, existe between Plightower, in his lifetime, an the efenant, Warner, this action having been brought, as the plaintiff alleges, to recover any balance that might be foun ue upon the-proper ajustment of such account, so as to bring his case within the provision of the 17th section of the statute of limitation (Dig.p. 698.) We have chosen to say that he offere to prove this fact of such a “ mutual open account current,” by this evience alone, because it is certifie to us by the court below, that the bill of exceptions in the recor, contains all the evience that was offere an rea to the jury on the trial of the cause, an we have examine the bill of exceptions closely, an fin in it no other, either offere an refuse, or actually prouce to the jury, which in the least conuces to prove any such “ a mutual open account current.” Uner such circumstances, then, i the court ¡below err in refusing to permit the plaintiff to rea the allege account in evience ?
To etermine this question we must ascertain the meaning of the section of the limitation act, just cite, in its connection with the other provisions of the statute'. Its own wors are its best exponent, that when an action shall be “ brought to recover any balance ue upon a mutual open account current, the cause of action shall be eeme to have accrue from the time of the last item prove in such account.” It was not to exempt open accounts current from the operation of the statute, not even when Such accounts were mutual, but to fix the point of time from which the statute woul begin to run on any such latter. Accoring to very common custom in this State, store accounts for goos sol, are ue the first ay of January following the year in which they are mae. From that time the statute orinarily begins to run upon them, the customer being suppose to have purchase with reference to this common custom, an therefore agreé to the maturity of the account at that time. Otherwise the general rule might apply, which is, in general, applicable to traesmen an artificers, &c., that the statute woul run from the ay of each article elivere, or piece of work one, an the continuation of the supply, or of the work one, woul not interrupt it; an iffering essentially from a uty which requires a continuation of services to complete the one act, as the uty of an attorney to commence an manage a suit. So the time for the closing of a mutual account current, might be stipulate for between the parties, either expressly or by implication, an the statute woul run on the balance from that ay, unless absorbe in a new mutual open account, in which the balance might form the first item. But if there be no stipulation between the parties, the statute enacts that the cause ofiaction shall be eeme to accrue from the ate of the last item. It is not, however, every open account current between parties, although they may severally have cross open accounts against each'other, that is a mutual one within the meaning of the statute. Such former woul of course be matter of set-off on either sie, an by agreement coul be converte into one inivisible open mutual account current; but unless by such agreement, either express or implie, they woul remain two several open accounts current, an not one entire inivisible mutual account, for which the balance only coul be proceee for, as contemplate by the section of the statute in question.
In the one mutual account current, contemplate by the statute, matters of set-off become converte eo instanti, into payment, an the balance only is recoverable. It is one consoliate transaction linke together, however numerous the items, by an alternative or correlative subsisting ebt on the one sie inucing the creit on the other. Agreement either express or implie, is of the very essence of such a mutual account current; because it is the act of the parties, an not the act of the law. The law but recognizes their act an carries out their intention as manifeste by their act. It oes not of its own force, convert cross ealings into one inivisible mutual account, but encourages gai’ties to o so, as it oes to use their cross emans as’set-off rather than institute an inepenent cross action upon them.
When, however, the parties elect to pursue the course of ealing contemplate by the statute, it necessarily results that any one item on either sie of the one mutual account woul raw to it every other item with which it was connecte by this chain of ealing, because in the view of the statutory provision-, we are consiering lire whole is one entire transaction. It coul not, however, possibly raw to it any item with which it was not so connecte for want of the essential element of the mutual agreement of the pai'ties. Analogous to a payment mae by a party who faile to exercise his right of appropriation, when making a payment to a creitor who hols two separate emans, one barre by the statute an the other not; an the creitor, in the exercise of his orinary right of appropriation, applies it in part liquiation of the stale eman, such woul not be a part payment within the statute, so as to revive the remey for want of the essential elements of appropriation by the ebtor.
Whether or not, then, in a case like this at bar, there was such a course of mutual ealings between the parties as is contemplate by the statute, is a material fact. An as such a course of ealings is foune upon the agreement of the parties, express or implie, an oes not necessarily follow', as the consequence of the fact, that each party may have an open account current against the other, there is no groun from which to presume such course of ealing, even prima facie from proof of the existence of a cross open account current, as there woul be to presume appropriation of a partial payment, mae generally to a creitor, who hel a subsisting eman ; because, in the latter case, in the absence of all repelling circumstances, the payment coul be referre to nothing else than to this subsisting eman, whereas, in the former case the creit given, which woul constitute the cross eman, might well enough, until the contrary shoul appear by facts or circumstances, be regare as a creit at large. In the usual course of ealings, men rarely pay money unless they owe it, whilst it is one of the most orinary circumstances in common life for a man to creit one he oes not owe.
If, therefore, the court ha permitte the evience in question to have gone to the jury,’unconnecte as it was with the proof of any other fact or circumstance, in any egree conucing to prove the existence of a mutual open account current, within the meaning of the statute, between the plaintiff’s intestate an the efenant, a verict foune upon it in favor of the plaintiff woul have been so utterly without evience to sustain it, that it coul not have been permitte to stan. So that even if we might think the evience in question competent as tening one step towars the establishment of the main fact, the burthen of which was upon the plaintiff to pr-ove, its exclusion uner the state of this case, as it appears upon the recor, in no way worke the prejuice of the plaintiff..
We .think, also, that there was no error in the court below to permit the reaing in evience, to prove the set-off, the “proceeings, recovery an recor,” as it appears by the bill of exceptions was allowe : an the jugment recovere in that court against the plaintiff, as aministrator, was, we think, a goo matter of set-off uner our statute. (Dig. ch. 150, sec. 2, 3.
We fin no error in the ruling of the court, either as to the instruction given, or those refuse. The ‘ruling as to these was substantially correct.
It was suggeste by the counsel for the appellee, that there was no question upon this recor for the consieration of this court, because, although the plaintiff below excepte to the ecision of the court overruling his motion for a new trial, he faile to have a bill of exceptions seale.
In the case of Berry vs. Singer, (5 Eng. R. at p. 490) we remarke that “ we woul not go the length that is apparently inicate in Sawyer vs. Lathrop (4 Eng. R. 67), of requiring that the evience shoul, in every case, be brought upon the recor, only after the overruling of a, motion for a new trial. On the contrary, we think that if it may have been brought regularly upon the recor before, an the recor shows istinctly that all the evience was so regularly of recor; as might well be one in exceptions that might be taken by bill to the giving or refusing to give instructions to the jury in orer to show the application or misapplication of the law to the facts, there woul be no more necessity in such case of reproucing such evience in the last bill of exceptions to the overruling of the motion for a new trial than there woul be to reconstruct any other part of the re-» cor. Because the waiver which is the result of a motion for a new trial, is no mutilation of the recor, proucing thereby any necessity for its reprouction in the last bill of exceptions, but simply a waiver of the right to insist upon exceptions taken uring the trial, as mere errors in law,” unless preserve by exceptions taken to the overruling of the motion for a new trial.
In the case at bar, all the evience prouce on the trial, an that which the court woul not allow to be prouce to the jury, as well as all the instructions given an refuse, are upon the recor regularly, an so is the motion for a new trial, an the exception of the appellant to the ecision of the court overruling his motion for a new trial. A bill of exceptions coul have therefore brought nothing more upon the recor than was alreay there; an that istinguishes this case from that of For vs. Clark, (7 Eng. R. 99), an several other cases.
Watkins, C. J., not sitting in this case.",legal_case
1862714,"The State vs. Lawson, late Sheriff","{'name_abbreviation': 'Ark.', 'id': 8808, 'name': 'Arkansas Supreme Court'}",1848-07,Ark.,"Mr. Justice Walker,
elivere the opinion of the court.
This was a proceeing by petition for a manamus to compel the efenant, as sheriff, to acknowlege a ee for certain lans, which the petitioner claims as purchaser at a juicial sale.
The petition is very full, as are also the recitals in the alternative writof manamus. The substance of the groun for manamus, is, that the efenant, as sheriff, offere for sale certain lots of lan, as the property of the Bank : that Johnson, at the instance of the state, an for her benefit, bi off the lan: that the State has been, an is yet reay an willing to pay the sum bi an has tenere the same to the sheriff, who refuse to receive it: that the sheriff well knowing these facts, execute an elivere to Johnson a ee to the State for sai lan: that the sheriff refuses to acknowlege such ee. An prays that he be require to o so, or to show cause why he shoul not be compelle so to o.
The efenant ecline acknowleging the ee,an for cause shows, that the lan was bi off by Johnson, as the attorney for the Bank, an that the petitioner was wholly unknown to him as purchaser: that he applie to Johnson for the sum bi which he refuse to pay; that uner the statute, upon such refusal, it became his uty to re-offer the property for sale, an that he i at the time an place, re-offer sai lan for sale, an sol it to Thomas W. Newton, to whom he execute an acknowlege a ee. Pie positively enies that either Johnson or the State or any one for them, tenere or offere the sum bi, until long after the complete consummation of the secon sale to Newton, but amits a tener by the State after that time. That his eputy took lists of the sales an mae out ees for the purchasers; that he has no recollection of having either signe or elivere a ee for the lan either to Johnson or the State. He is positive that he never intene to o so: that ees were mae out an signe, reay to be elivere when the purchase money was pai. Such ees were usually kept in a box in the clerk’s esk, an may have been taken without his knowlege.
To this response the State mae two replications: first, that the responent i not again offer sai lots for sale, at the time an place at which the first sale was mae: secon, that he i execute such ee to the State for sai lots, an that the same is his act anee. The first of these replications conclues to the country the secon, with a verification. An issues being taken upon them, they were submitte for trial to the court sitting as a jury. After hearing the evience the court foun for the efenant an renere jugment accoringly.
No exception was taken to the opinion of the court on a question of law, except as to the amissibilit}r of a certain eposition. An as there was no motion for a new trial, the correctness of the ecision of the court in excluing such evience presents the only legitimate question to be etermine.
The objection to the eposition, was that the official character of the justice, before whom the same was taken in Kentucky, was not sufficiently authenticate, in this, that what purporte to be the seal of'the Jefferson Circuit Court, was an impression upon paper, without wax or other soft tenacious substance. The court hel this objection goo an exclue the eposition. In this the court erre. In the absence of evience to the contrary, the court shoul have presume in favor of the regularity of the proceeing from the sister State. There may have been a statute there like our own, eclaring that an impression upon paper shall be a sufficient sealing: an whether this be the case or not, the later ecisions of the courts go to iscourage the objection an hol it frivolous. Pillow vs. Roberts, 13 How. U. S. S. C. Rep. 472. 7 Eng. 822.
But then the question recurs, amitting the epositions to be in other respects, unexceptionable, were they amissible uner the issue forme by the parties?
Waiving the consieration of the question whether a writ of manamus is the appropriate remey in this case, which we think extremely oubtful, an conceing the power of the court to compel the officer to perform a legal uty, still the court woul not exercise such power until a clear legal uty was shown, an it was mae to appear that the officer ha faile or refuse to perform it.
In this case the sheriff is calle upon to acknowlege a ee, which purports to have been execute by him as such to the petitioner. It is concee that the bi was mae by Johnson, an it is not shown that the sheriff was aware that the State ha any interest in the bi uuless after the secon sale of the property; but so far from this, the sheriff, in his answer uner oath, positively e nies all knowlege of the fact until after the secon sale: An this answer must be taken as true, because it is not questione by replication, nor is it isproven by other evience. The sheriff thus is cut off from all knowlege of the acts of the State. He coul not request her to pay, because she was unknown to him; an for the same reason an ability or reainess to pay by the Bank, not having been brought home to the sheriff, amounte to nothing. Thus left with Johnson, as the only known bier, who refuse to pay the sum bi, the sheriff, in obeience to the statute, re-offere the property, an sol it to a secon bier, who pai the sum bi to the sheriff. This secon sale was a revocation, uner authority of the statute, of the first bi; an no act of Johnson’s after that time coul restore him to the rights which he ha lost by refusing to pay the sum bi when calle upon.
The first replication is intene to put in issue the time when the secon sale took place. This we have hel, if true, a mere erroneous exercise of power which i not affect the valiity of the sale. Newton vs. State Bank.
An concee that the State i tener the money bi by Johnson, an claim the benefit of his bi, after the resale of the property, this coul not coaler a right on her to eman a ee for the property; because the bi uner which she claime was abanone by the refusal of the only known bier to pay the sum bi, an because the secon bier ha succeee to all his rights.
The ee subsequently foun in the possession of Johnson, bears ate eight ays after the secon sale of the property, an, if the contents of the ee are to be receive as evience, it must be taken all together, an woul show prima facie a ee signe an elivere to Johnson at that ate. If so, it was an act not warrante by law, an of course woul not be consummate by acknowlegment, by the sanction of a court. Uner the circumstances of the case, after the sale to Newton, the first bier stoo in no better situation than any one else; his bi was forfeite; there was no bi; a mere stranger ha as much right to eman a ee as he ha. But the sheriff positively enies the execution of the ee, an there is no proof of its execution except that arising from presumption: but if there was proof upon this point, it woul not avail.
It is not true, as the counsel for the State seem to suppose that the sheriff may charge himself with the sum bi an ispense with the payment of the money. This question was iscusse at length in the case of Dickson vs. Gillilan, 1 Cow Rep. 498. In that case the sheriff receive a large amount of the money an mae a ee to the junior lien creitor uner the New York statute. The first purchaser, at the expiration of the time allowe him to reeem, claime a ee, an it was orere to be mae to him, upon the groun that the sheriff ha no right to make the ee until the whole of the purchase money was pai. The policy of the law forbis that sheriffs shoul be permitte to substitute themselves as ebtors to the creitor. But even if this was permitte, it is evient that no court woul compel the sheriff to o so. Nor will the reainess of the State to pay authorize a ee after the secon sale, because the sheriff has exhauste his power an authority by a sale, an the receipt of the purchase money uner it.'
Returning theivto. the only question of law raise by the assignment of errors, the amissibility of the eposition as evience, limite in its application to the issues forme upon the replication, to the return of the sheriff on the writ of manamus, we are of opinion that ha it been amitte an ha proven every fact put in issue by the replications, that still upon the whole case, the ecision of the court was right, because the execution of the ee shoul have been before the sale to Newton an upon payment of'the money.
Let the jugment of the Puluski Circuit Court be in all things affirme.
Watkins, C. J., not sitting,",legal_case
