document_id,case_name,case_court,case_date,case_jurisdiction,text_content,document_type
1862647,Phelan ad. vs. Dalson,"{'name_abbreviation': 'Ark.', 'id': 8808, 'name': 'Arkansas Supreme Court'}",1853-07,Ark.,"Mr. Justice Scott
elivere the opinion of the Court.
This was action of replevin in the etinet. There was but one count, an in this it was allege in the usual form, that the efenant ha receive the plaintiff’s horse, an although often requeste ha not elivere him, but unlawfully etaine him. It was commence against Malay in his lifetime, who having been afterwars kille by Dalson, his aministrator, Phelan, interpose three pleas: first, non etinet', an in the other two, setting up property an the right of possession in ecease, Malay. Upon these pleas issues were joine, an submitte to a jury, who foun for Dalson, an jugment was renere accoringly. A new trial was move on the part of the aministrator, upon the groun of allege exclusion of competent testimony an of misirection of the jury. This motion was refuse an the cause was brought here by appeal upon a bill of exceptions.
From this, it appears that the line of efence relie upon an attempte to be establishe, was that the unqualifie ownership in the horse in question, of the ecease Malay in his lifetime, was in no egree affecte by the allege purchase of Dalson; because that originate in frau, an was consummate by the felonious act of knowingly paying the purchase money in counterfeit gol coin. To this en, the aministrator, after proving by a witness, that in February, 1852, Dalson came to the house of the ecease an offere him ninety ollars in gol for the horse; that he then left the house of the ecease, taking the horse along with him, accompanie by the ecease; that the ecease returne home after a short time, an forthwith hane over to the witness ninety ollars in gol pieces, which the witness then unerstoo from the ecease, that he ha receive from Dalson in payment for the horse, then offere to prove by the same witness the following aitional facts : That the ecease, Malay, ha no other money in his house at that time : that he owe two ebts in the neighborhoo, one of fifty ollars an the other of forty-five ollars ; that about that time he pai these two ebts with five ollar gol pieces : that the persons to whom these two several payments were mae, ascertaine that the gol pieces pai over to them by Malay were counterfeit gol coin, an immeiately returne them to Malay, then in life: that soon'after these facts transpire, Dalson left the country, an took with him the horse in question: that he was pursue an arreste on a charge of passing feloniously, ninety ollars of counterfeit gol coin on the ecease, Malay, was brought back to the county where the allege offence was committe, an there, after an examination by a competent court, was require to enter into a recognizance for his appearance before the Circuit Court of that county to answer that charge: that immeiately afterwars Dalsonkille Malay; an that certain eighteen pieces of counterfeit five ollar gol coin, then reay to be prouce to the jury, were the same that ha been pai over by Malay to the two persons before mentione, to whom he owe the ebts respectively. But the Circuit Court refuse to permit any of these facts to be proven to the jury, because, as is state in the bill of exceptions, “ that there was no proof nor offer on the part of the efenant to prove that the gol pieces allege to be counterfeit, were the same pai by Dalson to the ecease.”
It is true, that in this offer to prouce testimony to the jury there was no offer to prouce irect proof to establish the allege fact that the counterfeit gol coin prouce, were the same that were pai over by Dalson to Malay for the pui’chase money of the horse, but there was certainly an offer to prove a chain of facts an circumstances from which, although a conclusion to this effect woul not necessarily follow, it might have been arrive at by the jury within their just province. Even in criminal cases of the highest grae, that kin of circumstantial evience, classe by the elementary writers as uncertain, is amissible. But in such cases, “because of the more serious an irreparable nature of the consequences of a wrong ecision, the jurors are require to be satisfie beyon any reasonable oubt of the guilt of the accuse, or it is their uty to acquit him; the charge not being prove by that higher egree of evience which the law emans. In civil cases it is sufficient if the evience on the whole agrees with an supports the hypothesis which it is auce to prove; but in criminal cases it must exclue every other hypothesis, but that of the guilt of the party. In both cases a verict may be well foune on circumstances alone; an these often lea to a conclusion far more satisfactory than irect evience can prouce. (1 Greenl. Ev., 3 E. sec. 13, p. 74.
The court below therefore erre in refusing to permit proof of the facts, an circumstances offere to be shown in evience. Of their relevancy there coul be no question, as it is clear that where property has been, obtaine from the owner by a felonious act, his unqualifie ownership is not in the least change, an he may peaceably take it, in whose hans soever he may fin it. (Long on Sales, page 166, 7, 8, an cases there cite.
The ruling of the court in reference to instructions to the jury was substantially correct. But for the error touching the exclusion of evience, the jugment must be reverse an the cause remane to be proceee with.",legal_case
1862638,Sanger et al. vs. State Bank,"{'name_abbreviation': 'Ark.', 'id': 8808, 'name': 'Arkansas Supreme Court'}",1854-01,Ark.,"Mr. Chief Justice Watkins
elivere the opinion of the Court.
The plaintiffs in error being sue by the Bank, upon a note which they ha mae payable to her, interpose a plea, setting up certain matters in abatement. The plea, on motion of the plaintiff below, was stricken from the files, to which the efenants excepte, an suffere final jugment.
Inasmuch as the plea, re-instate upon the recor by the bill of exceptions, appears to be applicable to the action, an, for aught that appears, pleae in apt time, goo in form, signe by counsel an verifie by affiavit; in short, having all the formal requisites of a plea, our opinion is, that it ought to have been emurre to, if the plaintiff below woul question its legal sufficiency. This point was expressly rule in Sillivant vs. Rearon, 5 Ark. 140, followe by Wilson vs. Shannon, 1 Eng. 198. In Pope vs. Tunstall, 2 Ark. 209, the question of practice was waive, because the court thought the plea which ha been stricken out in that case, was goo in substance as well as form, an therefore felt at liberty to consier the case in the same light as if the pleaings ha come up on emurrer. But the case last referre to cannot be safely followe as a preceent, because the refusal of the court in any case that might come before it, to consier the legal,sufficiency of a plea, which ha been improperly stricken out on motion, woul be an implie ecision against its legal sufficiency; whereas, accoring to the establishe rules of pleaing, the proper moe of tenering an issue in law is by emurrer; an without breaking own those rules the emurrant cannot evae it by an informal motion, so as to eprive the efenant of all benefit of any question of law upon the legal sufficiency of the plea, unless he shall get it again upon the recor by bill of exceptions.
True, a plea, apparently goo on its face, might well be struck from the files, because frivolous or vexatious ; as for example, where the same matter is attempte to be pleae, which the court has once ajuge insufficient, an the pleaer coul only rest upon the ecision, or plea over. But nothing of the kin is shown here. An so, like many other legal istinctions, where the lines run into one another, it might sometimes be ifficult to etermine whether a party shoul move to strike from the files, or be put to his emurrer. But accoring as one or the other may be proper, the office of a emurrer cannot be subserve by a motion.
At an early ay, Means vs. Cromwell, 1 Ark. 247, this court foun it necessary to check the practice which ha grown up, of interposing by informal motions, not traversable or tenering any issue of fact, matters in abatement, or which properly belonge to that class of efences. An without any particular examination of that or the several subsequent cases to the same purport, there can be no oufitthat the general tenency of them to iscourage such innovations in pleaing was right.
Jugment reverse an cause remane with instructions to reinstate the plea, an leave to the plaintiff to emur.",legal_case
1862611,Ellis vs. Dunham,"{'name_abbreviation': 'Ark.', 'id': 8808, 'name': 'Arkansas Supreme Court'}",1853-07,Ark.,"Mr. Chief Justice Watkins
elivere the opinion of the Court.
Leaving out of view extraneous matters, the material facts, as amitte or proven, on the trial of this cause, appear to be as follows: One Malone mae his writing obligatory for the p&yment of money to Ellis, (the efenant below) ate October 20, 1846, anue six months after ate. On the 12th of June 1847, an after the obligation became ue, Ellis assigne it to one Hough, who, on the 10th of November, 1848, assigne it to Dunham (the plaintiff below). Hough an Dunham, respectively emane payment of Malone,' who i not pay, but when such emans were mae, oes not appear; nor oes it appear that any notice of the emans upon Malone, an his refusal to pay, was given to Ellis, until the ay before the suit was commence, when he was notifie in writing, by Dunham, of such eman an refusal, an that he woul be hel liable upon his assignment. The suit was commence on the 26th ay of April, 1849. The parties live in ajoining counties, the efenant about fifty miles, an Malone about fifteen miles from the plaintiff below. We take the fact, about which there was conflicting testimony, to be foun by the verict, that at the time of the assignment by the efenant to Hough, Malone the obligor was insolvent.
Among the various instructions aske for by both parties, the court, on the motion of the plaintiff, an against the objection of the efenant, charge the jury, to the effect, that if they believe from the evience that Malone, the maker of the bon, was insolvent at the time the assignment of it was mae by Ellis to Hough, the assignment was an original guaranty of the payment of the bon, an the efenant’s liability was fixe instantly, an the assignee was not boun to make eman of payment from Malone an give notice of non-payment, because he woul not be require to o a useless act. Also, that if Ellis assigne the bon after ue, such an enorsement was an original unertaking on his part, that the bon shoul be pai, an that no eman of payment of Malone, or notice of his refusal to pay, was necessary to fix the liability of Ellis."" Also, that the bon being assigne after ue, if they believe that both Hough an the plaintiff emane payment of Malone, an he refuse payment, an that the plaintiff gave the efenant notice of the eman upon the maker, an his refusal, at any time before the commencement of the suit, it was sufficient to fix the efenant’s liability. On the other han the court, at the request of the efenant, refuse to instruct the jury, to the effect that the efenant coul not be mae liable on his assignment, unless the plaintiff ha given him reasonable, or ue notice of non-payment by the obligor : also, that if the jury believe from the evience that the holer use no exertions to collect the note for several years, he thereby ischarge the enorser.
These instructions woul seem to have been given an refuse uner an entire misapprehension of the law. If the plaintiff sought to recover uner what may be calle the ol law of assignments — see Morse vs. Johnson, ecie at January term, 1853, he coul only o so against his immeiate assignor, upon the contract of assignment, by showing that he ha use ue iligence in suing the obligor or party primaiily liable, an in prosecuting him to insolvency, not repute but legal insolvency, evience by ischarge uner the insolvent acts from arrest upon ca. sa., or a return of nulla bona.
But the assignee in this case, in orer to recover against a remote assignor, between whom an himself, there was no privity of contract, must have availe himself of so much of the statute of assignments of 1837, Digest, Title, Assignments, sec. 9, as is introuctory of the law merchant an of its analogous rules.
The bon here being assigne after ue, the nature of the contract is that the enorsement is equivalent to the rawing of a new bill by the enorser upon the maker or obligor, who stans as acceptor of it, in favor of the enorsee, an payable on eman. An in orer to charge the enorser in such case, his contract being conitional upon receiving ue notice of non-payment, as at the law merchant, the assignee or enorsee (for uner this statute they seem to be convertible terms) must use reasonable iligence in presenting the bon or note, to the maker for payment. The time an manner of giving the notice woul be governe by the rules of the law merchant in similar cases. What woul be reasonable iligence in making the eman of payment, might often be a mixe question of law an fact for the jury to etermine, uner the instructions of the court, an accoring. as they may fin the facts proven. But, as hel in Jones vs. Robinson, 6 Eng. 511, the elay of presentment for so great a lapse of time in this case, not explaine or accounte for, amounte to gross negligence, an there being no question about this, as a matter of fact, the court below shoul have charge the jury what the legal conclusion was, viz : that the plaintiff ha faile to use ue iligence. No matter when the eman of payment was mae, it was nugatory an unavailing to charge the assign- or without notice to him of the non-payment, an the case here stans as if there ha been no presentment or eman of payment, until the ay before the suit was brought, nearly two years-after the assignment by the efenant to Hough.
Uner the statute, where the bon, bill or note, is transferre' before ue, the holer, by using ue iligence, may hol liable all or any of the prior parties. But where the transfer is after ue, we apprehen that it is each separate enorsement or assignment, that is equivalent to the rawing of a new bill, unless inee,, all the transfers are mae within the perio of iligence, which the law woul require at the hans of the first assignee; in. other wors, an over ue bon or note, cannot be transferre by various successive enorsements, at istant intervals of time, so as to subject all prior parties in one common liability to the last enorsee, as woul be the case when negotiable paper, payable at a fixe time, is enorse before ue. Supposing it to be law, that if Hough, the first assignee, by a seasonable eman upon the maker for payment, an notice of non-payment to the efenant, his immeiate assignor, ha thus fixe his liability upon the contract of assignment, any subsequent assignment of the bon or note by Hough, woul transfer that liability along with it as a chose in action to a remote assignee, yet it oes not follow that the first assignee of a note, past ue, having faile to fix the liability of his assignor by ue presentment an notice of non-payment, can by an assignment of his own, confer any authority upon a secon assignee, to revive or renew the conitional liability of the first assignor, which, by such neglect ha become ischarge. Uner these circumstances, the plaintifi below, by a prompt eman of payment of the original maker, an notice of non-payment to Hough, his immeiate assignor, might have hel him equally liable with the maker or obligor, an this, we think, woul be giving to the statute quite as liberal an beneficial construction as it is susceptible of: but without changing the whole character of the contract, the eman an notice to Hough woul not make the efenant liable, unless ue notice of eman an refusal ha been given to him. What is ue notice in such case woul be ascertaine by regaring him as the rawer of a sight raft upon the maker, an so any question of reasonable iligence on the part of the payee, or any holer of such raft, woul be etermine as at the law merchant!
It oes not seem necessary to notice any other errors, that might be consiere as appearing on this recor. The jugment will be reverse an the cause remane for trial anew.",legal_case
1862627,Holleville vs. Patrick,"{'name_abbreviation': 'Ark.', 'id': 8808, 'name': 'Arkansas Supreme Court'}",1850-07,Ark.,"S. H. Hempstea, Special Juge,
elivere the opinion of the Court.
This was an action of assumpsit, brought by Patrick against Holleville, an in which there was a trial by jury on the general issue, an a verict an jugment for Patrick, to review which this writ of error has been sue out by Holleville.
The eclaration contains two counts, similar to each other, but on two ifferent causes of action; an it may be remarke, that a eclaration coul harly be more inartificially rawn, an if we felt ispose to countenance technical objections, there woul be no ifficulty in fining them in it. The case stans in this court on the eclaration alone; because the bons an assignments therein escribe have not been mae a part of the recor by oyer, bill of exceptions or otherwise, an cannot be notice for any purpose whatever, although copie into the transcript.
The eclaration avers the writings obligatory to have been mae by William Strong an payable to Holleville on the 1st January, 1841; that they were before payment, assigne by him to Patrick, “to wit, on the 10th ay of July, 1841:” that when they became ue, they were presente fpr payment, an payment require “accoring to the tenor an effect thereof;” but that neither Strong nor Holleville pai the same; an it is then averre that “of all which sai premises the sai Holleville afterwars, to wit: on the 10th ay of July, 1841, ha notice.”
As a general rule, it is not to be enie, that a party is always boun by his own pleaings, an can make no proof in contravention of them. But it is equally as well establishe, as an exception, that it is not essential to state the real or precise time unless it constitutes a material part of the contract; nor in criminal proceeings, except where time forms an ingreient of the offence. An although a certain ay is state, yet neither in civil nor criminal cases, nee the ay be prove as lai, but an entirely ifferent ay may be prove, an it will be well enough. 1 Chitty's Pl. 288, 289. 1 Chitty's Cr. L. 224.
In assumpsit on a contract, whether express or implie, the plaintiff is at liberty to prove that it was mae at any other time than that allege. 2 Stra. 806. So, in an action against the acceptor of a bill payable after sight, an allegation that it was accepte on the ay of the ate will be prove, though it appear it was accepte on a subsequent ay. 1 Chitty's Pl. 288.
It was neither necessary nor usual to aver in the eclaration the precise time when the assignments were mae, or when payment was require, or notice of non-payment given. These were all matters of evience, which, for the sake of preserving brevity an perspicuity in pleaing, are never to be state. 1 Chitty's Pl. 258. Those ates were state uner a vielicet, an we are of opinion, might have been rejecte as surplusage, an which will not vitiate after verict. Chapman vs. Smith 13 John. 80. Hyslop vs. Jones, 3 McLean, 96. The case of Jackson vs. Henerson, 3 Leigh, 210, 217, is an express authority to the point, that if the eclaration avers that a bill was presente, an payment emane when the same became ue an payable, an then uner a scilicet, states a precise ay on which it was one, that ay is immaterial, nee not be prove, an may be rejecte as surplusage. To the same effect is the case of Bynner vs. Russell, 1 Bingham 23. S. C. 7 Moore 266, on the authority of which the case in Virginia was ecie.
It cannot amit of serious oubt, that it was competent for either party on the trial, to have prove that the assignments ha been mae, or that payment ha been emane, or notice of non-payment given at ifferent perios from those averre in the eclaration. Neitherparty was boun by those piecise ates, an might, as we have seen, have treate them as surplusage, an for aught we can know, such proof might have been actually-mae as above inicate.
This case was trie by a jury on the general issue. No exceptions were taken uring the trial, nor was any motion mae for a new trial, or in arrest of jugment. It stans on error, an consequently if the eclaration iscloses a cause of action the jugment must be affirme. The octrine on this subject is that when a eclaration or other pleaing sets forth a goo title or groun of action in a efective manner, the imperfection will be cure by verict, but a want of title is not aie. 1 Saun. 227, 2 Soun. 319, a, b. c. 10 Bac. Abr. Verict (X) 335.
An this court in Sevier vs. Holliay, 2 Ark. 571, approve an lai own the same principle, namely, that “where there is any efect, imperfection or omission in any pleaing, whether in substance or in form, which woul have been a fatal objection on emurrer, yet if the issue joine be such as necessarily requires on the trial, proof of the faots so efectively or imperfectly state, or omitte, an without which it is not to be presume that either the juge woul irect the jury to give, or the jury woul have given the verict, such efect, imperfection or omission is cure by the verict at common law.” Now no one can rea the eclaration without perceiving that it iscloses a right or cause of action, although partially obscure by the want of technical skill an precision in the pleaer. The imperfections in it are precisely of that character which a verict was intene, uner the rule above lai own, to cure. An it is the more essential that it shoul be so, because, inepenent of the general presumption of correctness which attaches to jugments of inferior courts until the contrary is mae to appear, we may well suppose that on the trial, such facts were prove as establishe the liability of the plaintiff in error, holing it clear that this might have been one uner the eclaration, an on the issue that was forme.
The case of Ruston vs. Aspinall, Dougl. 653, relie on by th© counsel for the plaintiff in error, is not applicable, because, the eclaration faile to allege a eman an refusal by the acceptor; but in this eclaration, eman, refusal an notice are allege. Consiering that the eclaration in this case iscloses a cause of action, an that the imperfections in it'are cure by the verict, an we affirm the jugment.
Watkins, C. J. not sitting.",legal_case
1862665,"Couch, Ex parte","{'name_abbreviation': 'Ark.', 'id': 8808, 'name': 'Arkansas Supreme Court'}",1854-01,Ark.,"Mr .Justice Scott
elivere the opinion of the Court.
At the October term, 1852, of the county court of Pulaski county, certain proceeings, to which Couch was a party, touching a public roa, were finally ecie aversely to him. He took a bill of exceptions, file an affiavit, an praye an appeal to the Circuit Court, which the County Court grante. On the 6th of December following, a certifie transcript of the proceeings was file in the Circuit Court, an on the 20th of January, 185#; on motion of the attorney general, Couch being present an resisting, the Circuit Court ismisse the suppose cause, to which Couch, by his attorney, excepte, an sue out a writ of error to this court.
There was really no cause in the Circuit Court to ismiss. The prayer for an appeal,, an the action of the County Court upon it ha no legal effect to transfer the cause to the Circuit Court: nor i the filing of the transcript there, on the part of Couch, have any such effect. Not that the Circuit Court ha no appellate jurisiction of such a cause, but because no steps ha been taken to invoke that jurisiction. Such steps can be taken in the Circuit Court only in the absence of statutory regulations, touching such cases, of which we have none, beyon the act of the 21st December, 1846, (Dig. p. 313, sec. 12), investing the Circuit Court with intermeiate appellate power, but making no regulations for its exercise.
Until the Legislature shall think proper to make such regulations, the Circuit Courts, at the instance of parties, must use their common law an other means known to the law, to give effect to these intermeiate appellate powers thus investe in them as (Carnall vs. Crawfor county, 6 Eng. R. at p. 613), to matters properly cognizable in the County Courts, an not provie for by the act of the 4th January, 1849, (Pamph. Act p. 59). The case of Carnall vs. Crawfor county, was within the provisions of this latter act an was brought into the Circuit Court in accorance with its regulations, an it was hel that in such ca.ses the Legislature contemplate a qualifie trial e novo in the Circuit Court, as provie for appeals from the Probate Court. Cases like this at bar, however, being unprovie for by statute, remain, as at common law, an are subject to be quashe or affirme only in the Circuit Court, as the case may be. The process in the Circuit Court performing the functions of a writ of error, (ib. at p. 614).
Neither the constitution nor any statute of this State invests the county court with exclusive j urisiction in matters of public roas, close to superior review; on the contrary these courts are oubly open to the primary review of the Circuit Courts clothe, as they are, with constitutional power of superintening an statutory power of intermeiate appeal. Doubtless, therefore, when the party in this case shall properly present his case in the Circuit Court, he will be entitle to have it hear an have the oings in the County Court either quashe or affirme.
Fining no error in the action of the Circuit Court, its oings in this case must be affirme.
Watkins, C J., not sitting»",legal_case
