document_id,case_name,case_court,case_date,case_jurisdiction,text_content,document_type
1862655,Ruddell vs. Folsom,"{'name_abbreviation': 'Ark.', 'id': 8808, 'name': 'Arkansas Supreme Court'}",1853-07,Ark.,"Mr. Justice Walker
elivere the opinion of the Court.
This suit is brought against Ruell alone, on the joint obligation of Moore an himself. The bon was barre by the statute of limitations, unless the bar was remove by part payment-The efenant pleae the statute of limitations, to which the plaintiff replie generally. Uner this issue, the plaintiff offere evience of such part payment, but the efenant objecte to the evience upon two grouns, first, that the evience offere was-incompetent an inamissible to prove part payment; an secon, that if amissible as evience in other respects, it u as inamissible uner the issue forme. The court overrule his objections an permitte the evience to be given uner the issue, to which the efenant excepte. The same question was again-presente upon a motion for a new trial; an upon exception to-the opinion of the court in refusing, to grant a new trial, the case* is brought here by appeal.
Uner the issue forme it evolve upon the plaintiff to prove-that the cause of action ha accrue within five years next before-the commencement of the suit, which ates from-the filing of the bon, which, uner the statute, is in effect a eclaration, an the issuing of the writ thereon, an the time- when the bon fell ue ; facts to be establishe by the terms of the contract, an the recor evience of the commencement of the suit. If the plaintiff shoul seek to avoi the force an effect of this evience,by show-in§,a new promise, or a new an ifferent point from which the-statute bar commence to run, it is an affirmative matter, the truth of which he must show, an he must also necessarily confess the time at which the bar, by the terms of the contract, commence running. It is then necessarily like matter in confession an avoiance, an shoul be so replie.
Chitty, in his work on pleaing, vol. 1, page 583, says that, when the plea is that the cause of action i not accrue within, &c., the plaintiff coul prove a promise or acknowlegment within.that time, an that the replication might, in such case, be general; but if the time of issuing the first writ in the action were material, it must have been replie specially : an as, that a special replication is, in general, avisable. An upon this istinction as to whether the plea oes, or oes not put the time of issuing the writ in issue, rest all the cases to which the plaintiff has referre, except the cases ecie in Massachusetts Reports, which, upon quite a ifferent state of case, give preference to the proceeing by special replication, an in case the time of issuing the writ is putin issue, make it inispensably necessary to plea specially. Greenleaf, in his work on Evience, vol. 2, sec. 440, page 416, says, “ that if the plaintiff woul avoi the bar by proof of an acknowlegment of the claim, he can only o it uner a special replication of a new promise within the time limite.” An so, also, the exceptions in favor of merchant an merchant, an other exceptions must be replie specially. I. sec. 447-448.
In the case of Trustees vs. Hartfiel, 5 Ark. Rep. 557, the precise question as to whether part payment coul or not be given in evience uner the general replication, was not iscusse; but the court in passing upon the sufficiency of the special replication, hel, that part payment might be given uner the general replication, or might be replie specially.
In Walker vs. Bank Mississippi, 2 Eng. Rep. 504, although the question was not irectly before the court, an for that reason cannot be hel as overruling in express terms the case of Trustees vs. Hartfiel, the court hel that an avoiance of the statute bár by limitation, uner any of the exceptions of the statute, shoul be specially replie. An in Ringgol & Hynson vs. Dunn, 3 Eng. 497, the same rule was hel, when more fully presente, an in still stronger terms. In McClellan vs. The Bank, 7 Eng. 141, where a general replication was file to a plea of the statute of limitation, the recor of a former suit brought on the same cause of action was offere in evience, to bring the case within the exception of the 24th section, Dig. chap. 99, which allows the plaintiff to renew his action within one year next after a jugment of non-suit, it was hel that in orer to let in evience of such former suit, the plaintiff shoul have file a special replication setting up such facts in avoiance of the statute bar.
An in the case of Woos vs. State Bank, 7 Eng. 697, an also in a case still more recently ecie, Bank vs. Conway, January term, 1853, it was hel the safer an more regular practice to require part payment, when relie upon to remove the statute bar, to be specially replie. So that it is not now an open question of practice, but one sactione an approve by this court, both upon soun principles of pleaing an authority: an being, in our opinion, best calculate to present the efinite matter in issue isencumbere from the other facts which might arise uner the general replication, an to limit the proof to it, we o not feel at liberty to epart from it.
Evience of part payment was, therefore, inamissible uner the issue as forme, an shoul have been exclue by the court, inepenent of all consieration of its sufficiency otherwise, which we will next procee to consier.
There were several creits upon the bon, all of which, except one, purporte to be payments mae by Moore, the obligor, not sue. The first payment appears to have been mae by Moore, an, if proven to have been mae at the time it bore ate, woul have remove the statute bar. To prove this the plaintifF offere in evience the following instrument, to-wit: “All of the above creits were mae by me, except the three ollars, an the ates of the creits are correct. Decir. 2, 1850. (signe) Wm. Moore.” An after proving the execution thereof, offere the same, together with the first enorsement of a payment (which purporte to have been mae by Moore) as evience, an the same, against the objections of the efenant, were amitte as evience to the jury.
In orer to prove part payment, as against a co-obligor, it must be shown that such payment was mae at a time when its legal effect woul be to remove the statute bar. Bank vs. Wooy, 5 Eng. 643. Woo vs. Wyls, 6 Eng. 759. The mere enorsement of a creit, as of a ate to effect this, isjnot of itself sufficient: but it must be shown that the enorsement of payment was in fact mae within such time. But where the enorsement is mae by the obligors, or one of them, then proof of that fact will be sufficient evience to permit the enorsement to be rea as evience, as well of the ate as the fact of payment.
After the statute bar has attache no act or amission of one •co-obligor will bin another. Trustees vs. Jenkins, et al. 5 Eng. 108. Such acts an amissions are alone bining upon the party making them. Moore’s amissions, therefore, at the time when they were mae, whether wiitten or verbal, were inamissible as evience against Ruell, an shoul have been exclue. He was not sue, an was clearly a competent witness to prove the fact of such payment, as well as the time when it was mae, whether mae by Ruell or himself.
Let the jugment be reverse, an the cause remane, with leave to the plaintiff to file a special replication.",legal_case
1862668,Hutt Ex parte,"{'name_abbreviation': 'Ark.', 'id': 8808, 'name': 'Arkansas Supreme Court'}",1854-01,Ark.,"Mr. Chief Justice Watkins,
elivere the opinion of the Court.
The petitioner represents that he is the plaintiff in a certain action at law, pening in the Pulaski Circuit Court, now in session, the suit being brought upon a promissory note, which ha been assigne to the plaintiff. That the efenant in the Circuit Court, uring its present term, after having oyer of the instrument sue on, emurre for a variance between the escription of the plaintiff’s name as set out in the eclaration an that isclose by the instrument given on oyer. That the only variance consiste in this, that the plaintiff sue as Anre, an the assignment as fille up, an which was one by the plaintiff’s attorney through mere inavertence was Anrew,it being the same Christian name, accoring as it is spelt in French or English. That the court there has sustaine the emurrer for the suppose variance, an thereupon the plaintiff, by leave of the court, has correcte the mistake in the filling up of the assignment, by inserting Anre instea of Anrew, That the efenant making no further efence, the plaintiff move for jugment for want of a plea; but the court there has, on motion of the efenant, an without any showing being mae therefor, orere the cause to be continue until the next term, thereby enying the petitioner his legal right to have jugment for his ebt; wherefore he prays that a manamus issue against the juge of that court commaning him to set asie the orer of continuance an progress with the cause.
It will be concee that a manamus is the only aequate specific remey for a suitor, where the inferior court refuses to exqrcise its jurisiction, an will not procee to ajuicate a cause pening before it, of which it has cognizance, an where no reason appears for such refusal. The manamus will go to compel the court to act, but not to control its juicial iscretion, by irecting it what jugment to give, or to review the correctness of any ecision mae uring the progress of a cause; else the manamus woul become an inirect substitute for the final review by writ of error or appeal. The proceeing by manamus to compel a Circuit Juge, sitting as a chancellor, to grant an injunction as praye upon any given case presente to him by the bill, an which he has refuse, is in the nature of an. appeal allowe by statute, from some interlocutory orer or ecree of the inferior court.
Accoring to the report of Dixon vs. Feil, 5 Eng. 243, mainly relie on by the petitioner here, it was, as we think, an extreme case to warrant the issuance of a manamus. But amitting, upon the authority of the opinion in that case, that a manamus will lie to control the iscretion of the inferior court in the continuance of a cause, where that iscretion is so palpably abuse as to amount to a enial of justice, the case here is ifferent.
The court below ecie the emurrer. If the petitioner was aggrieve by the ecision, his only remey was to rest upon it an suffer final jugment, which coul be reviewe on a writ of error of appeal. He might then require this court to ecie whether the groun of emurrer was frivolous, or the variance so trifling as to he amenable, without occasioning any surprise or pretext for elay to the efenant. The petitioner acquiesce in the ecision upon the emurrer by making the amenment conformable with iff Accoring to the case presente by the petition, it will be impossible to grant the manamus without reviewing the correctness of that ecision. By the 6th rule of practice for the Circuit Courts, aopte by this court at July term 1848, when a emurrer to a eclaration is sustaine, the emurrant is entitle to a continuance of the cause: an while that rule remains in force, the continuance follows of necessity from the ecision of the court sustaining the emurrer, no matter how erroneous in point of law.
Application refuse.",legal_case
1862614,"Yell, Gov. use Conant & Co. vs. Outlaw et al.","{'name_abbreviation': 'Ark.', 'id': 8808, 'name': 'Arkansas Supreme Court'}",1854-01,Ark.,"Mr. Chief Justice Watkins,
elivere the opinion of the Court.
Bogy an Bonne, two of the efenants here, have pleae in bar of the w'rit of error, that at the May term, 1851, of the Jefferson Circuit Court, at which the jugment brought up by this writ for revision, was renere, the now plaintiff in error praye an appeal from the same jugment, which appeal was uly prosecute, an upon the filing of the transcript, the appeal was ockete; the appellant assigne errors, an these efenants joine therein, an such further proceeings were ha, that the appeal came on to be hear an was submitte to this court for its final ecision an ajuication therein. The plaintiff emurs because the plea fails to show that the appeal is still pening an unetermine, or that it has been prosecute to final jugment in this^ court.
The ecision at July term, 1853, granting the motion of the appellant in the cause referre to by the plea, for leave to is- . miss the appeal after submission, seems to be also ecisive of the question here presente. We are content to say that the right of an appellant to ismiss, at his own costs, an appeal in a common law case, an sue out a writ of error to the same jugment, oes not epen upon the enquiry, whether the appeal was actually pening in.this court, or whether being so pening it ha been prosecute own to submission. We take the istinction to be between those cases where the appeal oes not operate as a superseeas, an those, on the other han, where by operation of law or the act of the suitor, by entering into recognizance, the execution is staye upon the granting of the appeal to this courti If the successful party in the court below, is not hinere by the appeal from having execution, no goo reason is perceive why* the appellant may not ismiss his appeal, at any time before the final ajuication of it, with like effect, as if he ha brought the cause here for revision by writ of error, without superseeas. As the plea fails to show that by the original appeal, the execution of the jugment became suspene, it is not sufficient to bar the present writ of error. The penency of the appeal at the time of suing out the writ of error, might be goo in abatement of the latter proceeing, but woul not be appropriately mae in bar.
In Clay vs. Notrebe, 6 Eng. 631, this court went so far as to refuse to abate a writ of error, upon a plea that an appeal ha been taken in the court below with stay of execution in the same cause. Though the ecision there turne upon the issue mae by the pleaings, whether the appeal ha been in fact pening in this court, the juge elivering this opinion is constraine to think it was an immaterial issue; because where there has been a superseeas, the option of the appellant to abanon his appeal an bring error, is inconsistent with the right of the appellee, uner the statute, to have an affirmance of the jugment, unless the appeal is iligently prosecute; besies, upon appeals taken in the Circuit Court, the stay of execution oes not epen upon the opinion of any court or juge, who, in his iscretion, may think there is probable groun of error, but the suspension is eman-able at the pleasure of the appellant, upon the sole conition of his ability to furnish satisfactory security. But waiving any such consieration it is certainly a much stronger case than the present one.
Demurrer sustaine.",legal_case
1862736,Thompson vs. Haislip,"{'name_abbreviation': 'Ark.', 'id': 8808, 'name': 'Arkansas Supreme Court'}",1853-07,Ark.,"Mr. Justice Walker
elivere the opinion of the Court.
The first groun of exception in this case is as to the correctness of the ecision of the Circuit Court in sustaining the plaintiffs emurrei'jto the efenants plea in abatement. The matter pleae in abatement was a varíen ce between the writ of summons an a copy of the summons serve upon the efenant. This was no groun for abating the action; at most it was an inirect attack upon the sheriff’s return. If the sheriff ha not, in fact, serve the efenant with a true copy of the writ, an ha falsely returne a vali service, it might become the subject of inquiry upon a irect proceeing against him for a false return, but was no groun whatever for abating the writ. Hughes vs. Martin, 1 Ark. Rep. 386. The plea shoul have been stricken out! There was no necessity for emurring to it, but the objection by emurrer was also goo. An issue-upon it, if tenere, woul, in fact, have settle nothing beyon a question of service.
The secon groun is that after a jugment by efault an upon inquiry of amages before the jury, the efenant was ene the privilege of cross-examining the witnesses introuce to establish the amount of amages sustaine.
In this we think there was error. By failing to appear an. efen, or after having appeare an pleae in abatement, the failure of the efenant to plea in bar, was a confession of the plaintiff’s right to recover amages, an although after such efault or failure to plea, the efenant coul not be hear to eny that some amages were recoverable, still, it was not an amission of any particular amount of amages. If so, there woul be no necessity for a writ of inquiry of amages; an although we have not foun any ajuicate case settling the practice in such cases, we can see no goo reason why the efenant shoul be eprive of his right to cross-examine the witnesses introuce by the plaintiff upon the trial of the inquiry of amages, in orer to show truly what amages ha been sustaine.
In this case we o not know what the question intene to be aske was, nor o we know the range of enquiry inulge upon the examination in chief. The opinion of the court woul seem to eny all cross-examination, irrespective of the nature or extent of the enquiry. Without, therefore, knowing what the particular state of case was, or intening to be unerstoo as eciing that any an all evience, which, uner proper issues forme, woul ten to lessen the amount of amages, may be offere by the efenant upon an inquiry of amages, uner the state of case pre sente we think the Circuit Court erre in refusing the efenant permission to cross-examine the plaintiff’s witnesses. An for this error the jugment of the Circuit Court must be reverse, an the cause remane.",legal_case
