document_id,case_name,case_court,case_date,case_jurisdiction,text_content,document_type
1862699,Refeld et al. Exs. vs. Bellette et al.,"{'name_abbreviation': 'Ark.', 'id': 8808, 'name': 'Arkansas Supreme Court'}",1853-07,Ark.,"Mr. Justice Walker
elivere the opinion of the Court.,
This is an action of replevin brought by the appellees against the appellants, for the wrongful taking of slaves. The efenants file two pleas, non cepit an property in themselves, as the executors of the last will an testament of Freerick Notrebe, ecease. By written consent an agreement, an agree statement of the facts was submitte to the court as a special verict.
The facts or special verict is substantially this: John Baptiste Bellette an his wife, Elizabeth Bellette resie with, or in the immeiate vicinity of Freerick Notrebe, (who ha marrie their aughter,) for twenty-five years, an uring that time, an prior to the 17th of July, 1835, the sai John Baptiste ha renere services to sai Freerick, in the management of his business. In consieration of which an one ollar, on the ay last aforesai, the sai Freerick, by ee in fee simple, conveye to the sai John Baptiste, two lots of lan in the village of Arkansas. An at the same time, by a separate ee, for the same consieration, he grante, bargaine, an sol to the sai John Baptiste, five negro slaves, who with their incréase, are the slaves now in suit, as his absolute property an estate- An on the same ay, sai Notrebe also execute to the sai Bellette’the following instrument, to wit: “Know all men by these presents, that I, Freerick Notrebe, of the Post of Arkansas, Territory an county of Arkansas, eclare to whom it may concern, that my father-in-law, John B. Bellette (alias Enselma) renere me services 25 years, an by his care, economy an continue assiuity to protect my interests, has been an aitional han to help me in accumulating an saving some property. An in consequence a remuneration from me to him, is only just an equitable, an without any cause whatever prejuicial to my chilren, I am willing, an by these presents, o will that my sai father-in-law be inepenent in his ol age from the caprice of my sai chilren, an for these reasons alone, (not incluing many others of some weight) an in case I ie before him, as Go an Provience best knows, I wish an inten, that he shall take out of my estate, before any ivien be mae by my chilren, or their representatives, the sum of three thousan ollars, in lawful money, or the equivalent in property at a fair valuation, at his option; an I absolutely will an orer that my heirs, executors, or aministrators shall truly an honestly execute this act, as a legitimate compensation ue to the sai J. B. Bellette, the father of my ear an belove wife, Felicite. I also wish an inten, that shoul my mother-in-law, Elizabeth Bellette, o service to my sai father-in-law an myself, then, that she will receive the legal interest of the sai onation of $3,000, for her lifetime, an request my chilren to a any surplus, (if they are able) to give her a full competency, an to rener her happy. The house an the slaves given to my father-in-law, by two instruments of wi'iting, bearing the same ate as this one, will be also her property for life, an shall have an keep possession, to enjoy.it as her own property.”
These three instruments were uty execute an elivere to the sai Bellette, in whose hans they remaine until his eath; until which time the female slaves continue in his possession an exclusivé use, an the males also, or others in their place. Notrebe, uring the lifetime of Bellette, set up no claim to the slaves, but on the contrary, amitte the title to be in Bellette, by offering to buy or swap for one of them. He i, however, pay taxes on them in his own name. The families (Notrebe an Bellette’s) live pretty much as one family, though occupying ifferent builings. Notrebe furnishe provisions for both. Bellette ie in possession of the slaves in 1838. After his eath Mrs. Bellette occupie a room in the same house with Notrebe as a member of his family. In 1843 or 1844 Notrebe enie Mrs. Bellette’s right to the property. In 1843 he mae his will, the tenth article of which is as follows: “Having alreay given as a gift by a ee, an a bill of sale uner ate of July the 17th, 1835, some property an slaves to the late John B. Bellette, (alias Enselma) my father-in-law, which has not been expene by him in his lifetime, the same property is to be revertible as a life estate to his wiow, Elizabeth Bellette, my mother-in-law, an having also secure to the sai late John B. Bellette ecease, by an instrument of writing, uner ate July 17th, 1835, a sum of three thousan ollars in property, at fair valuation, to be receive from my estate after my ecease, if in nee of it, now the same clause is also in favor of, an revertible to the sai Elizabeth Bellette, my mother-in-law, an my absolute will an esire are, that this promise be effecte after my ecease, if she is in want, an to be fulfille to the last point. An I recommen my belove wife, an my two heirs, John an Mary, to continue to cherish her in her ol age, an to treat her well in procuring my mother-in-law as goo a maintainance as circumstances will enable my wife an two heirs, John an Mary, for their goo ol mother an granmother.”
In 1849, Notrebe ie, leaving his wife an mother-in-law, the plaintiffs in this suit, who uner the facts above, claim jointly the slaves in controversy. The efenants on the other han, claim the slaves as the executors of the last will of Mr. Notrebe.
The court below upon the agree facts, or special verict eclare the law to be in favor of the plaintiffs an renere jugment accoringly. From which ecision, uner the special reservation of exception in the submission of the facts to the court, the efenant excepte, an by appeal has brought the-case before us for ecision.
There is in this case no question as to facts, they having been ascertaine an agree upon, an we are calle upon to eclare the law which arises upon them.
At the outset it is contene by the appellant, that the three first instruments bearing the same ate an mae touching the same subject matter, shoul be taken as one instrument; an that as the latter was testamentary in its character, the others must follow it, an thereby they shoul all be so consiere. It is true that these several instruments werebetween the same parties, an were eviently intene for atwo-fol common purpose: to provie means for the present comfort an inepenent support of an age relative, an also, in case of contingency to provie for further support after the eath of the obligor or onor. The present wants of Mr. Bellette were supplie by an absolute ee for a house, an slaves to wait upon an work for him. The first two instruments, absolute an unconitional, effecte this; an although there is manifeste throughout a praiseworthy solicitue on the part of Mr. Notrebe to provie for his father-in-law, above all care for remuneration, still it is expressly amitte by him, an we must so consier it, that these instruments were mae upon a full an valuable consieration. They are neither gifts nor legacies, but ees of sale upon valuable consieration, not to take effect at a future ay, but instantly, an which, in this instance, was followe up by the actual possession an enjoyment of the property. Mr. Notrebe amitte the property to be Mr. Billette’s until after his eath, an after that time, as we shall presently see, he might well have asserte claim to the property. The thir instrument, it is true, relates to the same subject matter, an although that too, is acknowlege to be upon full consieration, an only what is ue, it is mae to epen upon two contingencies; first, the eath of Mr.- Notrebe, an seconly, the pecuniary circumstances of Mr. Bellette. Amitting the testamentary character of this instrument in several leaing particulars, we are not of opinion it can raw to it the other two instruments an efeat their obvious intent an legal effect.
If we were permitte to consier these as voluntary gifts, without other consieration than the respect an regar of Mr. Notrebe for his father-in-law, an a sense of uty to provie for him the means of support, after he, by his eath, shoul be no longer permitte to o so, then the argument of counsel an authorities cite, to which we have given attentive consieration, woul have their full force an application, but these instruments evience a sale of property to pay a ebt, a ebt amitte by Mr. Notrebe, an therefore conclusive upon him. By the force an effect of each of them, a perfect title veste in Mr. Bellette, which no subsequent act of Mr. Notrebe coul efeat. If the effect of the thir instrument, as contene for, is to constitute these three instruments one, an to make them all testamentary, then Mr. Notrebe woul have ha an unquestionable right to revoke them at pleasure uring his life. But surely it cannot be contene that a bill of sale vesting an absolute title in slaves, upon full an valuable consieration coul, after its execution, be revoke; an yet such must be the consequence, if the argument of counsel be correct. The very nature of these instruments forbis that they shoul be consiere testamentary. In the case of Habergham vs. Vincent, 2 Ves. Jr. 204, the ee was execute after the will, mae in reference to it, an coul only exist in it: whatever title passe was in reference to the will. Here the bill of sale was at the same ate, upon full consieration, an coul well exist an take effect without reference to the thir instrument. We are satisfie that the slaves passe to Mr. Bellette, an were hel by him as his absolute property, an at his eath, became the property of Mr. Notrebe, by virtue of his marriage with the aughter an sole heir of Mr. Bellette, subject to the ower interest of his wife, Mrs. Elizabeth Bellette. At the eath of Mr. Notrebe, uner the provisions of the tenth article of his will, Mr. Bellette acquire a life estate in the slaves. Of course, as Mr. Notrebe hel them subject to her ower interest, he coul only convey by will such interest as he ha, which when taken in connection with her ower interest veste in her an absolute estate for life.
We have not overlooke the statute, sec. 56, Dig. ch. 4, which exempts property acquire by the wiow from sale,to pay ebts, &c., but that statute coul not in our opinion affect the right of the husban to sell or evise the estate.
This being our conclusion, it follows, that Mrs. Notrebe has no present interest or estate in the slaves an was improperly mae a party plaintiff in the suit.
Mrs. Bellette’s right as evisee veste at the eath of Mr. Notrebe, but the question is, can she assert such right by action at law against the executor. We shoul think not; at least until the ebts are pai, or time allow'e for paying them, because she takes her title uner the will, subject to the payment of ebts, an the estate passes into the hans of the executor in the first place to satisfy ebts. Upon this point we have been referre to several authorities, which we think quite satisfactory. Anrews vs. Hunneman. 6 Pick. Rep. 129. Toller's Ex. 306. Lynch vs. Thomas, 3 Leigh 682, settle the question as to the right of the executor to hol the property in the first instance for the payment of ebts. The right of the legatee to his legacy is suspene, until by the assent of the executor or the lapse of time, for the settlement of the estate, this suspension is remove. Thus in Mississippi, where A. bequeathe a slave to B., which was in B’s possession at the testator’s eath, it was hel that the executor might recover hire for the perio of one year after the grant of letters testamentary, he having until that time to examine into an settle the estate. King vs. Cooper, Walker's Miss. Rep. 389.
Replevin is a possessory action, an the plaintiff, in orer to maintain it, must have at the commencement of his suit, a right to the possession. Uner the circumstances of this case, it is consistent with the rights of the parties an the evience, to suppose that the slaves w'ere, at the time of Mr. Notrebe’s eath, in. the possession of either Mrs. Bellette or himself. They both live together; the slaves ha been up to the eath of Mr. Bellette, in his possession, an after his eath became by operation of law, the joint property of Mr. Notrebe as heir, in right of his wife, an of Mrs. Bellette as the wiow entitle to ower. If, after the eath of Mr. Notrebe, she retaine an possese herself of the slaves, an the estate of Mr. Notrebe was clearly sufficient to pay his ebts without rawing upon specific legacies, then slight circumstances might be sufficient from which to infer assent; such as continue acquiescence by the executor in her possession, after time ha been allowe to examine into the conition of the estate. How this was, the facts as agree upon o not show.
In view, therefore, of the whole case, without unertaking to say, from the facts before us, whether Mrs. Bellette might or not have maintaine her action in replevin for the recovery of the slaves in her own right, it is very clear that no action coul be maintaine by Mrs. Bellette an Mrs. Notrebe jointly, because, as we have seen, Mrs. Notrebe ha neither title nor right of possession to the slaves.
The court below therefore erre in eciing the question of law arising upon the agree facts or special verict, in favor of the right of the plaintiffs jointly to maintain their action, an in renering jugment thereon for the plaintiffs.
Let the jugment be reverse an set asie.
Watkins, C. J., not sitting.",legal_case
1862651,Carnall as ad. vs. Wilson,"{'name_abbreviation': 'Ark.', 'id': 8808, 'name': 'Arkansas Supreme Court'}",1854-01,Ark.,"Mr. Justice Walker,
elivere the opinion Of the Court-.
This is a suit in chancery, brought in the. Crawfor Circuit Court for the purpose of having correcte a mistake in the escription of certain lans to which the complainant sets up title. The substance of the complaint is, that John Dillar, who resie in the county of Crawfor, was the legal owner of several quarter an fractional quarter sections of lan; composing one tract of about 937 acres, on which he ha a farm an resie with his family in the year 1841, an continue there to resie until his eath. On the 14th ay of September of that year, jugment was renere against him in the Crawfor Circuit Court, in favor of Thomas E. an Heiro T. Wilson, for $3,800, upon which execution issue on the 3 of August, 1842, which at the instance of Dillar, was levie upon the tract of lan oil which he so resie, but that the sheriff, in recoring his levy upon the writ, misescribe several of the tracts of lan levie upon, by recoring other tracts, not the property of Dillar, instea of those actually levie upon; that afterwars, at the instance of Dillar, his lans were appraise, an because no one woul bi two-thirs of their value, they were returne not sol. On the 30th August, 1843, an alias fi. fa. issue, on the back of which was enorse the former levy, an that uner this writ the sheriff avertise an sol the lan on the 25th of September, "" 1843, at public sale, to George W. Paschal for $500, to whom he execute' a ee for the same. That the same mistake committe in recoring the return- of the levy upon the original writ was continue in the after proceeings incluing the avertisements of the lan, an the ee to Paschal; but that the actual levy an sale were of Dillar’s lan.
It appears that Dillar was in embarrasse circumstances, an that several other jugments ha been renere in sai court against him, all of which as well as that of the Wilsons’ were uner the control of Paschal for collection. That at the instance of Dillar, it was agree between himself an Paschal, that Paschal shoul buy the property, then recognize by Dillar as his homestea place, an give him (Dillar) twelve months to reeem the same by paying Wilson’s jugment, an part of one of the other jugments uner Paschal’s control as collector. That Dillar ie without having reeeme the property, an that Paschal afterwars, on the 14th ay of September, 1849, conveye the lan to Joseph H. Bailey, by quit claim ee, for $3,000, an that Bailey on the same ay sol itto complainant for $1,000, payable in twelve months, an took from complainant a bon lor the payment of the purchase money, an execute to him a covenant, by which he boun himself to convey to complainant the lan upon the payment of the bon for $1,000. That both Paschal an Bailey in goo faith sol, an intene to convey the Dillar homestea place, but were le into a mistake in the escription of the lan by following that in the sheriff’s ee. Soon after the purchase óf complainant the mistake was iscovere, to correct which this suit is brought.
The plaintiff in execution, the aministrator an heirs of Dillar, Paschal an Bailey are mae efenants, an with the exception of the aministrator an one of Dillar’s chilren, an infant, the answers may be consiere as a full an circumstantial amission of the material- facts in issue.
The- aministrator enies all knowlege or information with regar to the levy, or sale of the property, or of any knowlege, unerstaning or agreement of his intestate, except that which he erive from the complainant’s bill, an touching these points oes not answer. The other allegations are from information an belief amitte. The infant efenant answers by guarian, an his rights are as fully protecte as if he ha by answer enie each allegation in the bill.
The main fact put in issue by the answer, is the fact of the allege mistake; an preliminary to an examination of the evience, is the question presente upon the exception to the amission of the eposition of Ogen. The objection to his evience is, that he is the security of the complainant to efenant Bailey for the purchase money of the lan in suit. It seems that Bailey at the outset was content to take the complainant’s bon, payable at twelve months, for the purchase money, an to hol the lan as secui’ity for the pa3'ment thereof. But when he ascertaine that there was a mistake in the numbers of the lan, whereby his security for the purchase money to the value of the lans not embrace in the ee ha faile, he became issatisfie an thereupon, by way of aitional security Ogen, Paschal, an others, execute to him a note for $1,000 payable at the same time the first note was to have been pai, with a memoranum enorse thereon by Bailey, that the payment of the bon first given shoul be a ischarge of the note,, whereby Ogen in effect became the security for the purchase money for the lan, part of which is now here in suit. This aitional security was taken in consequence of the iscovere mistake. There can be no question of Ogen’s immeiate interest in the suit; inee this is broaly amitte by counsel who notwithstaning argue that his interest is equally balance, because, let the suit be ecie for or against the complainant he must be ischarge. If for him, by requiring the $1,000 for which he is boun to- be pai before the ecree is renere, or if against him,, the court must necessarily rescin the contract, an cancel the note. As regars the first proportion, although the court might have ecree the payment ofthe purchase money at that time, it i not necessarily follow that such shoul be the ecree : an the ecree renere in this cause shows that such was not the case; so far from it, the express terms of the ecree are that the security shall not be ischarge. An, as respects the .other alternative, a rescisión of the contract is wholly inconsistent, as well with the allegations as the prayer for relief; au the answer of Bailey furnishes no groun for enlarging the issue. If the plaintiff ha oubts as to his title to the specific relief praye, he ■shoul have presente his case in a ouble, aspect, an praye relief accoringly. Story Equity Pl. 42. Moore vs. Maen, 2 Eng. 530.
Bailey no oubt was willing that the correction shoul be mae, his answer is alone responsive to that state of case, but it by no means follows that he woul assent to have his contract can-celle, an the eviences of ebt surrenere, upon a mere question of partial failure of consieration, nor can it be that a chancellor woul ecree that he shoul o so, unless upon an issue for that purpose an upon which he might be hear in efence, it be foun equitable that it shoul be one, so that the witness coul not -escape his liabilily upon either alternative; certainly not in the last, an it seems he i not in the first. He was clearly incompetent to testify, an his eposition shoul have been suppresse.
The remaining evience is by no means satisfactory upon the most important points in issue: the actual levy an sale of the lan not inclue in the sheriff’s return.
As regars the levy, the facts that the process was against Dillar, that there was returne upon the writ about the same quantity of lan really owne by him, that the valuation was taken at his instance, an that the appraisers i actually appraise the property known as Dillar’s homestea place, are all strong circumstances, an yet there is no positive proof that the sheriff ever intene to levy, or i levy upon these lans; but on the contrary, there are his official returns on several writs, his avertisement an ee, all his official acts which show affirmatively that he i not make such levy. As regars the sale, but one witness is foun to testify. He is strongly impresse with the belief that the sheriff announce to the by-staners that he offere the Dillar homestea place; of this he is not positive, an oes not remember the language use, nor can he say positively, that the sheriff i more than rea off the numbers from his levy, but thinks he i. This witness says that there were some forty persons present, an the fact that out of that number but one witness was examine as to the unerstaning at the time of the sale, in regar to the property sol, reners it improbable that if the property was offere as Dillar’s homestea, it was generally so unerstoo by the biers an by-staners.
The evience, upon which a written instrument or contract is altere or correcte, must be clear an free from oubt. In Henkle vs. The Royal Exchange Insurance Company, 1 Ves. 317, Lor Harwick sai the court ha jurisiction to relieve in re-. spect to a plain mistake in contracts in writing. In Ingram vs. Chil 1 Bro. 94, Lor Thurlow sai, “that a mistake creating an equity e hors the ee, shoul be proven as much to the satisfaction of the court as if amitte.” Juge Story in Unite States vs. Monroe, 5 Mason 577, sai “in cases of asserte mistakes in written instruments, it is not enie that a court of equity may reform the instrument, but such a court is very slow to exercise such an authority, an it requires the strongest an clearest evience to establish the mistake. It is not sufficient that there be some reason to presume a mistake, the evience must be clear, unequivocal an. ecisive.” An in Gillaspie vs. Moore, 2 Johns, Ch. Rep., Chancellor Kent reviews many of the English ecisions an fully recognizes the rule, that in all such cases the mistake must be clearly an fully proven.
So that this rule, when applie to contracts, may be consiere as well settle, an there certainly is no goo reason why the rule shoul not also be applie with equal force to the return ot a sworn officer, an to his ee eliberately mae an approve in court. Whilst therefore, corrections may be mae of mistakes when clearly an satisfactorily proven to be such, less than this strictness woul be attene with the most serious consequences, particularly where the instrument to be reforme or change is, as in this instance, the evience of title to real estate,
When teste by this rule, the evience before us, although it oes raise a strong presumption that the levy an sale were mae or intene to be mae of Dillar’s entire homestea tract, is not of that clear an conclusive character to entitle the complainant to relief.
We have not overlooke the groun taken by counsel, that the sale was mae uner a fi.fa., with a former levy enorse thereon, instea of a ven. ex. to sell the lans so levie upon, an that the whole tract was offere together instea of separate tracts, an also that the lans now sought to be recovere were (if sol at all) sol without having been previously avertise. These are all questions which may well be consiere in a suit like this, in the nature of a bill for specific performance, because courts of equity will not interfere to ecree specific execution of a contract, where manifest wrong or injustice woul result from it. To o so woul be giving ai to consummate a wrong commence, which is never one, 2 Story Equity 53.
It is true, that in this case the process an proceeings uner which the sale was mae, in connexion with the return, in which no formal levy appears to have been mae uner the secon writ, are of a oubtful character, (in regar to which, however, it is not necessary, uner the circumstances of this case, to express any opinion) an that the sale of the lans in ispute (if mae at all) was mae without notice an purchase by the attorney for the plaintiff in execution for $500, when, accoring to the appraise value mae some time before the sale took place, they were worth $7,900 or more, an by evience in this case, since the sale, $3000. §o that the lan was sol in all reasonable probability, for less than one-sixth of its actual value. All of these circumstances woul have been presente for consieration if the mistake as allege ha been satisfactorily proven.
.But as .such proof has not been auce, in view of the whole case .an the peculiar attitue in which the parties are presente upon the recor, an the facts connecte with their respective fights, we .think the ecree of the Circuit Court shoul be reverse an the bill ismisse.
Let the ecree be reverse, an the cause be remane with instructions to ismiss the bill with costs.
Watkins, C. J., not sitting.",legal_case
